{
  "generatedAt": "2026-02-24T13:43:50.571234+00:00",
  "version": 3,
  "htmlPaths": [
    "周雨/品牌介绍/index.html",
    "周雨/待办清单/index.html",
    "小明/测试项目/index.html",
    "林夏/个人简历/resume.html",
    "林夏/数据面板/index.html",
    "赵星河/作品集卡片/index.html",
    "赵星河/活动落地页/landing.html",
    "陆雨奇/中国留学黄页/index.html"
  ],
  "members": [
    {
      "name": "周雨",
      "projectCount": 2,
      "projects": [
        {
          "id": "周雨/品牌介绍",
          "member": "周雨",
          "name": "品牌介绍",
          "entry": "周雨/品牌介绍/index.html",
          "pages": [
            "周雨/品牌介绍/index.html"
          ],
          "pageCount": 1,
          "routeMode": "path"
        },
        {
          "id": "周雨/待办清单",
          "member": "周雨",
          "name": "待办清单",
          "entry": "周雨/待办清单/index.html",
          "pages": [
            "周雨/待办清单/index.html"
          ],
          "pageCount": 1,
          "routeMode": "path"
        }
      ]
    },
    {
      "name": "小明",
      "projectCount": 1,
      "projects": [
        {
          "id": "小明/测试项目",
          "member": "小明",
          "name": "测试项目",
          "entry": "小明/测试项目/index.html",
          "pages": [
            "小明/测试项目/index.html"
          ],
          "pageCount": 1,
          "routeMode": "path"
        }
      ]
    },
    {
      "name": "林夏",
      "projectCount": 2,
      "projects": [
        {
          "id": "林夏/个人简历",
          "member": "林夏",
          "name": "个人简历",
          "entry": "林夏/个人简历/resume.html",
          "pages": [
            "林夏/个人简历/resume.html"
          ],
          "pageCount": 1,
          "routeMode": "path"
        },
        {
          "id": "林夏/数据面板",
          "member": "林夏",
          "name": "数据面板",
          "entry": "林夏/数据面板/index.html",
          "pages": [
            "林夏/数据面板/index.html"
          ],
          "pageCount": 1,
          "routeMode": "path"
        }
      ]
    },
    {
      "name": "赵星河",
      "projectCount": 2,
      "projects": [
        {
          "id": "赵星河/作品集卡片",
          "member": "赵星河",
          "name": "作品集卡片",
          "entry": "赵星河/作品集卡片/index.html",
          "pages": [
            "赵星河/作品集卡片/index.html"
          ],
          "pageCount": 1,
          "routeMode": "path"
        },
        {
          "id": "赵星河/活动落地页",
          "member": "赵星河",
          "name": "活动落地页",
          "entry": "赵星河/活动落地页/landing.html",
          "pages": [
            "赵星河/活动落地页/landing.html"
          ],
          "pageCount": 1,
          "routeMode": "path"
        }
      ]
    },
    {
      "name": "陆雨奇",
      "projectCount": 1,
      "projects": [
        {
          "id": "陆雨奇/中国留学黄页",
          "member": "陆雨奇",
          "name": "中国留学黄页",
          "entry": "陆雨奇/中国留学黄页/index.html",
          "pages": [
            "陆雨奇/中国留学黄页/index.html"
          ],
          "pageCount": 1,
          "routeMode": "path"
        }
      ]
    }
  ],
  "projects": [
    {
      "id": "周雨/品牌介绍",
      "member": "周雨",
      "name": "品牌介绍",
      "entry": "周雨/品牌介绍/index.html",
      "pages": [
        "周雨/品牌介绍/index.html"
      ],
      "pageCount": 1,
      "routeMode": "path"
    },
    {
      "id": "周雨/待办清单",
      "member": "周雨",
      "name": "待办清单",
      "entry": "周雨/待办清单/index.html",
      "pages": [
        "周雨/待办清单/index.html"
      ],
      "pageCount": 1,
      "routeMode": "path"
    },
    {
      "id": "小明/测试项目",
      "member": "小明",
      "name": "测试项目",
      "entry": "小明/测试项目/index.html",
      "pages": [
        "小明/测试项目/index.html"
      ],
      "pageCount": 1,
      "routeMode": "path"
    },
    {
      "id": "林夏/个人简历",
      "member": "林夏",
      "name": "个人简历",
      "entry": "林夏/个人简历/resume.html",
      "pages": [
        "林夏/个人简历/resume.html"
      ],
      "pageCount": 1,
      "routeMode": "path"
    },
    {
      "id": "林夏/数据面板",
      "member": "林夏",
      "name": "数据面板",
      "entry": "林夏/数据面板/index.html",
      "pages": [
        "林夏/数据面板/index.html"
      ],
      "pageCount": 1,
      "routeMode": "path"
    },
    {
      "id": "赵星河/作品集卡片",
      "member": "赵星河",
      "name": "作品集卡片",
      "entry": "赵星河/作品集卡片/index.html",
      "pages": [
        "赵星河/作品集卡片/index.html"
      ],
      "pageCount": 1,
      "routeMode": "path"
    },
    {
      "id": "赵星河/活动落地页",
      "member": "赵星河",
      "name": "活动落地页",
      "entry": "赵星河/活动落地页/landing.html",
      "pages": [
        "赵星河/活动落地页/landing.html"
      ],
      "pageCount": 1,
      "routeMode": "path"
    },
    {
      "id": "陆雨奇/中国留学黄页",
      "member": "陆雨奇",
      "name": "中国留学黄页",
      "entry": "陆雨奇/中国留学黄页/index.html",
      "pages": [
        "陆雨奇/中国留学黄页/index.html"
      ],
      "pageCount": 1,
      "routeMode": "path"
    }
  ],
  "stats": {
    "memberCount": 5,
    "projectCount": 8,
    "pageCount": 8
  }
}
